{
  "$schema": "https://json-schema.org/draft/2020-12/schema",
  "$id": "https://periscope.invalid/schemas/governance.schema.json",
  "title": "Governance",
  "description": "Container for the governance screen (R8, F3 step 4, A-2). Two lists and a sourced argument, which may be empty if verification strikes every paragraph (N6 option (b)). The statements required by L2 are pinned by identifier, so the screen cannot ship without them. Every statement in either list names the tests that verify it (verifiedBy), which turns a claim about the demo into a checkable one; that is why the container, and with it both lists, is labelled real (DM-2). The argument is drafted by the Architect during G3 from the Scout's frozen regulatory source list (Q-5 outcome, 5 Oct 2026), so every argument paragraph carries its own required label, fixed to ai-generated, and at least one dated source. Shipped in data/governance.js.",
  "type": "object",
  "additionalProperties": false,
  "required": ["id", "implemented", "notImplemented", "argument", "label", "provenance"],
  "properties": {
    "id": { "const": "governance" },
    "implemented": {
      "type": "array",
      "minItems": 4,
      "items": {
        "type": "object",
        "additionalProperties": false,
        "required": ["id", "text", "verifiedBy"],
        "properties": {
          "id": { "$ref": "common.schema.json#/$defs/slug" },
          "text": { "$ref": "common.schema.json#/$defs/text" },
          "verifiedBy": {
            "type": "array",
            "minItems": 1,
            "uniqueItems": true,
            "items": { "$ref": "common.schema.json#/$defs/testId" }
          }
        }
      },
      "allOf": [
        { "contains": { "required": ["id"], "properties": { "id": { "const": "open-web-sources-frozen" } } }, "minContains": 1, "maxContains": 1 },
        { "contains": { "required": ["id"], "properties": { "id": { "const": "no-viewer-data-stored-or-sent" } } }, "minContains": 1, "maxContains": 1 },
        { "contains": { "required": ["id"], "properties": { "id": { "const": "no-live-ai" } } }, "minContains": 1, "maxContains": 1 },
        { "contains": { "required": ["id"], "properties": { "id": { "const": "no-accounts-cookies-analytics" } } }, "minContains": 1, "maxContains": 1 }
      ]
    },
    "notImplemented": {
      "type": "array",
      "minItems": 3,
      "items": {
        "type": "object",
        "additionalProperties": false,
        "required": ["id", "text", "verifiedBy"],
        "properties": {
          "id": { "$ref": "common.schema.json#/$defs/slug" },
          "text": { "$ref": "common.schema.json#/$defs/text" },
          "verifiedBy": {
            "description": "The tests that show the feature is absent from this build (for example the storage audit for cross-session-persistence, or M8-U8 for role-aware-model), mirroring the implemented list, so that 'not implemented' is a checked claim and not only a sentence (Red-team finding N5).",
            "type": "array",
            "minItems": 1,
            "uniqueItems": true,
            "items": { "$ref": "common.schema.json#/$defs/testId" }
          }
        }
      },
      "allOf": [
        { "contains": { "required": ["id"], "properties": { "id": { "const": "own-data-ingestion" } } }, "minContains": 1, "maxContains": 1 },
        { "contains": { "required": ["id"], "properties": { "id": { "const": "cross-session-persistence" } } }, "minContains": 1, "maxContains": 1 },
        { "contains": { "required": ["id"], "properties": { "id": { "const": "role-aware-model" } } }, "minContains": 1, "maxContains": 1 }
      ]
    },
    "argument": {
      "description": "What own-data ingestion would require before it could be built, as paragraphs in reading order. This is one continuous argument, not a list of peers, so its order is the order of the reasoning. Each paragraph states conditions, not advice (C-6), and cites at least one dated source that the Verifier has opened; a paragraph it cannot tie to a listed source is cut, not softened. If no paragraph passes, the fallback is a single paragraph citing the GDPR's own definition of personal data (gates.md, Q-5). minItems is 0 (N6 option (b), decided by Miguel, 5 Oct 2026): if even the fallback is struck, the array is empty, the container still freezes, and the screen ships both lists with the withheld sentence (F3-S3a) instead of an argument. Nothing unverified ships, and F3-E2 still must not ship.",
      "type": "array",
      "minItems": 0,
      "items": {
        "type": "object",
        "additionalProperties": false,
        "required": ["id", "text", "sources", "label"],
        "properties": {
          "id": { "$ref": "common.schema.json#/$defs/slug" },
          "text": { "$ref": "common.schema.json#/$defs/text" },
          "sources": {
            "type": "array",
            "minItems": 1,
            "items": { "$ref": "common.schema.json#/$defs/sourceRef" }
          },
          "label": {
            "description": "Fixed by the Q-5 outcome: machine-written prose is labelled ai-generated (M1-U17).",
            "const": "ai-generated"
          }
        }
      }
    },
    "label": {
      "description": "real: the two lists are statements about the demo, each item backed by named tests (DM-2). The argument paragraphs carry their own label.",
      "const": "real"
    },
    "provenance": { "$ref": "common.schema.json#/$defs/frozenProvenance" }
  }
}
